text,title,urls,,,,,,,,,,,,,,,,,,,,,,,,,,,,,,,,,,,,,,,,,,,,,,,,,,,,,,,,,,,,,,,,,,,,,,,,,,,,,,,,,,,,,,,,,,,,,,,,,,,,,,,,,,,,,,,,,,,,,,,,,,,,,,,,,,,,,,,,,,,,,,,,,,,,,,,,,,,,,,,,,,,,,,,,,,,,,,,,,,,,,,,,,,,,,,,,,,,,,,,,,,,,,,,,,,,,,,,,,,,,,,,,,,,,,,,,,,,,,,,,,,,,,,,,,,,,,,,,,,,,,,,,,,,,,,,,,,,,,,,,,,,,,,,,,,,,,,,,,,,,,,,,,,,,,,,,,,,,,,,,,,,,,,,,,,,,,,,,,,,,,,,,,,,,,,,,,,,,,,,,,,,,,,,,,,,,,,,,,,,,,,,,,,,,,,,,,,,,,,,,,,,,,,,,,,,,,,,,,,,,,,,,,,,,,,,,,,,,,,,,,,,,,,,,,,,,,,,,,,,,,,,,,,,,,,,,,,,,,,,,,,,,,,,,,,,,,,,,,,,,,,,,,,,,,,,,,,,,,,,,,,,,,,,,,,,,,,,,,,,,,,,,,,,,,,,,,,,,,,,,,,,,,,,,,,,,,,,,,,,,,,,,,,,,,,,,,,,,,,,,,,,,,,,,,,,,,,,,,,,,,,,,,,,,,,,,,,,,,,,,,,,,,,,,,,,,,,,,,,,,,,,,,,,,,,,,,,,,,,,,,,,,,,,,,,,,,,,,,,,,,,,,,,,,,,,,,,,,,,,,,,,,,,,,,,,,,,,,,,,,,,,,,,,,,,,,,,,,,,,,,,,,,,,,,,,,,,,,,,,,,,,,,,,,,,,,,,,,,,,,,,,,,,,,,,,,,,,,,,,,,,,,,,,,,,,,,,,,,,,,,,,,,,,,,,,,,,,,,,,,,,,,,,,,,,,,,,,,,,,,,,,,,,,,,,,,,,,,,,,,,,,,,,,,,,,,,,,,,,,,,,,,,,,,,,,,,,,,,,,,,,,,,,,,,,,,,,,,,,,,,,,,,,,,,,,,,,,,,,,,,,,,,,,,,,,,,,,,,,,,,,,,,,,,,,,,,,,,,,,,,,,,,,,,,,,,,,,,,,,,,,,,,,,,,,,,,,,,,,,,,,,,,,,,,,,,,,,,,,,,,,,,,,,,,,,,,,,,,,,,,,,,,,,,,,,,,,,,,,,,,,,,,,,,,,,,,,,,,,,,,,,,,,,,,,,,,,,,,,,,,,,,,,,,,,,,,,,,,,,,,,,,,,,,,,,,,,,,,,,,,,,,,,,,,,,,,,,,,,,,,,,,,,,,,,,,,,,,,,,,,,,,,,,,,,,,,,,,,,,,,,,,,,,,,,,,,,,,,,,,,,,,,,,,,,,,,,,,,,,,,,,,,,,,,,,,,,,,,,,,,,,,,,,,,,,,,,,,,,,,,,,,,,,,,,,,,,,,,,,,,,,,,,,,,,,,,,,,,,,,,,,,,,,,,,,,,,,,,,,,,,,,,,,,,,,,,,,,,,,,,,,,,,,,,,,,,,,,,,,,,,,,,,,,,,,,,,,,,,,,,,,,,,,,,,,,,,,,,,,,,,,,,,,,,,,,,,,,,,,,,,,,,,,,,,,,,,,,,,,,,,,,,,,,,,,,,,,,,,,,,,,,,,,,,,,,,,,,,,,,,,,,,,,,,,,,,,,,,,,,,,,,,,,,,,,,,,,,,,,,,,,,,,,,,,,,,,,,,,,,,,,,,,,,,,,,,,,,,,,,,,,,,,,,,,,,,,,,,,,,,,,,,,,,,,,,,,,,,,,,,,,,,,,,,,,,,,,,,,,,,,,,,,,,,,,,,,,,,,,,,,,,,,,,,,,,,,,,,,,,,,,,,,,,,,,,,,,,,,,,,,,,,,,,,,,,,,,,,,,,,,,,,,,,,,,,,,,,,,,,,,,,,,,,,,,,,,,,,,,,,,,,,,,,,,,,,,,,,,,,,,,,,,,,,,,,,,,,,,,,,,,,,,,,,,,,,,,,,,,,,,,,,,,,,,,,,,,,,,,,,,,,,,,,,,,,,,,,,,,,,,,,,,,,,,,,,,,,,,,,,,,,,,,,,,,,,,,,,,,,,,,,,,,,,,,,,,,,,,,,,,,,,,,,,,,,,,,,,,,,,,,,,,,,,,,,,,,,,,,,,,,,,,,,,,,,,,,,,,,,,,,,,,,,,,,,,,,,,,,,,,,,,,,,,,,,,,,,,,,,,,,,,,,,,,,,,,,,
"
,
,In the most general of terms, , is the arrangement of , to create some combination of ,, ,, ,, ,, or otherwise ,., , vary depending on culture,, though it is an aspect of all human societies and a ,., While scholars agree that music is defined by a ,, there is , on their precise definitions., The creation of music is commonly divided into ,, ,, and musical ,,, though the topic itself extends into ,, ,, ,, ,, and ,. Music may be performed or improvised using a vast range of ,, including the ,, and thus is often credited for its extreme versatility and opportunity for creativity.,
,In some musical contexts, a performance or composition may be to some extent ,. For instance, in ,, the performer plays spontaneously while following a partially defined structure and using characteristic motifs. In ,, the performers may take turns leading and responding while sharing a changing set of notes. In a , context, there may be no structure whatsoever, with each performer acting at their discretion. Music may be deliberately composed to be , or ,. Music is played in public and private areas, highlighted at events such as ,, ,, and , performances, and heard incidentally as part of a , or , to a film, TV show, opera, or ,. Musical playback is the primary function of an , or ,, and a universal feature of , and ,.
,Music often plays a key role in social activities, ,, , ceremonies, celebrations, and cultural activities. The , includes songwriters, performers, ,, producers, tour organizers, distributors of instruments, accessories, and ,. Compositions, performances, and recordings are assessed and evaluated by ,, music journalists, and ,, as well as amateurs.
,The modern English word ',' came into use in the 1630s., It is derived from a long line of successive precursors: the , ',' of the mid-13th century; the , , of the 12th century; and the , ,., The Latin word itself derives from the , , (,)—, (,)—literally meaning ""(art) of the Muses""., The , were nine , in , who presided over , and ,., They were included in tales by the earliest Western authors, , and ,,, and eventually came to be associated with music specifically., Over time, , would reside over music more prominently than the other muses., The Latin word , was also the originator for both the Spanish , and French , via spelling and linguistic adjustment, though other European terms were probably ,, including the Italian ,, German ,, Dutch ,, Norwegian ,, Polish , and Russian ,.,
,The modern , usually defines music as an all-encompassing term used to describe diverse genres, styles, and traditions., This is not the case worldwide, and languages such as modern Indonesian (,) and , (,) have recently adopted words to reflect this universal conception, as they did not have words that fit exactly the Western scope., Before Western contact in ,, neither Japan nor China had a single word that encompasses music in a broad sense, but culturally, they often regarded music in such a fashion., The closest word to mean music in ,, ,, shares a character with ,, meaning joy, and originally referred to all the arts before narrowing in meaning., Africa is too diverse to make firm generalizations, but the musicologist , has emphasized African music's often inseparable connection to dance and speech in general., Some African cultures, such as the , of the , and the , of Nigeria, have a strong and broad conception of 'music' but no corresponding word in their native languages., Other words commonly translated as 'music' often have more specific meanings in their respective cultures: the Hindi word for music, ,, properly refers to ,,, while the many , have words for music that refer specifically to song but describe instrumental music regardless., Though the , , can refer to all music, it is usually used for instrumental and metric music, while , identifies vocal and improvised music.,
,It is often debated to what extent the origins of music will ever be understood,, and there are competing theories that aim to explain it., Many scholars highlight a relationship between the origin of music and the ,, and there is disagreement surrounding whether music developed before, after, or simultaneously with language., A similar source of contention surrounds whether music was the intentional result of , or was a byproduct , of evolution., The earliest influential theory was proposed by , in 1871, who stated that music arose as a form of ,, perhaps via mating calls., Darwin's original perspective has been heavily criticized for its inconsistencies with other sexual selection methods,, though many scholars in the 21st century have developed and promoted the theory., Other theories include that music arose to assist in organizing labor, improving long-distance communication, benefiting communication with the ,, assisting in community cohesion or as a defense to scare off predators.,
, can only be theorized based on findings from , archaeology sites. The ,, carved from a , ,, is thought to be at least 40,000 years old, though there is considerable debate surrounding whether it is truly a , or an object formed by animals., The earliest objects whose designations as musical instruments are widely accepted are , from the ,, Germany, namely from the ,, , and , caves., Dated to the , (of the Upper Paleolithic) and used by ,, from all three caves there are eight examples, four made from the , of birds and four from ,; three of these are near complete., Three flutes from the Geissenklösterle are dated as the oldest, , BP.,
,The earliest material and representational evidence of Egyptian musical instruments dates to the ,, but the evidence is more securely attested in the , when ,, , and , were played., Percussion instruments, ,, and , were added to orchestras by the ,. , frequently accompanied music and dance, much as they still do in , today. Egyptian ,, including the traditional , rituals, are the closest contemporary , to , music, having preserved many of its features, rhythms and instruments.,
,The "","", found on , in the ancient , city of ,, is the oldest surviving notated work of music, dating back to approximately 1400 BCE.,
,Music was an important part of social and cultural life in ,, in fact it was one of the main subjects taught to children. Musical education was considered to be important for the development of an individual's soul. Musicians and singers played a prominent role in ,,, and those who received a musical education were seen as nobles and in perfect harmony (as can be read in the ,). Mixed gender , performed for entertainment, celebration, and spiritual ceremonies., Instruments included the double-reed , and a plucked ,, the ,, principally a special kind called a ,. Music was an important part of education, and boys were taught music starting at age six. Greek musical literacy created significant musical development. Greek , included the Greek ,, that eventually became the basis for Western , and , music. Later, influences from the ,, Eastern Europe, and the , changed Greek music. The , is the oldest surviving example of a complete musical composition, including musical notation, from anywhere in the world., The oldest surviving work written on the subject of music theory is , by ,.,
,Asian music covers a swath of music cultures surveyed in the articles on ,, ,, ,, ,, and ,. Several have traditions reaching into antiquity.
, is one of the oldest musical traditions in the world., Sculptures from the , show dance, and old musical instruments, like the seven-holed flute. Stringed instruments and drums have been recovered from , and , by excavations carried out by ,., The ,, an ancient Hindu text, has elements of present Indian music, with musical notation to denote the meter and mode of chanting., Indian classical music (marga) is ,, and based on a single melody line or , rhythmically organized through ,. The poem , provides information about how new scales can be formed by modal shifting of the tonic from an existing scale., Present day , was influenced by , and , Mughals. ,, popular in the southern states, is largely devotional; the majority of the songs are addressed to the Hindu deities. There are songs emphasizing love and other social issues.
, has been formed since the , culture migrated to the , in the 2nd-3rd centuries BCE. Indonesian traditional music uses percussion instruments, especially , and ,. Some of them developed elaborate and distinctive instruments, such as the , stringed instrument on the island of Rote, the , ,, and the complex and sophisticated , and , , orchestras. Indonesia is the home of ,, a general term for a set of small, high pitched pot gongs. Gongs are usually placed in order of note, with the boss up on a string held in a low wooden frame. The most popular form of Indonesian music is gamelan, an ensemble of tuned , that include ,, ,, , and , along with , , (like a ,).,
,, the traditional art or court music of China, has a history stretching over about 3,000 years. It has its own unique systems of musical notation, as well as musical tuning and pitch, musical instruments and styles or genres. Chinese music is ,-,, having a scale of twelve notes to an octave (5 + 7 = 12) as does European-influenced music.,
,The , era (500 to 1400), which took place during the ,, started with the introduction of , (single melodic line) , into , services. , was used since ancient times in ,, but in the Middle Ages, notation was first introduced by the Catholic Church, so chant melodies could be written down, to facilitate the use of the same melodies for religious music across the Catholic empire. The only European Medieval repertory that has been found, in written form, from before 800 is the monophonic , , chant of the Catholic Church, the central tradition of which was called ,. Alongside these traditions of , and , there existed a vibrant tradition of , (non-religious songs). Examples of composers from this period are ,, ,, ,, and ,.,
, (, to 1600) was more focused on secular themes, such as ,. Around 1450, the , was invented, which made printed , much less expensive and easier to mass-produce (prior to the invention of the press, all notated music was hand-copied). The increased availability of sheet music spread musical styles quicker and across a larger area. Musicians and singers often worked for the church, courts and towns. Church choirs grew in size, and the church remained an important patron of music. By the middle of the 15th century, composers wrote richly polyphonic sacred music, in which different melody lines were interwoven simultaneously. Prominent composers from this era include ,, ,, ,, , and ,. As musical activity shifted from the church to aristocratic courts, kings, queens and princes competed for the finest composers. Many leading composers came from the Netherlands, Belgium, and France; they are called the Franco-Flemish composers., They held important positions throughout Europe, especially in Italy. Other countries with vibrant musical activity included Germany, England, and Spain.
,The Baroque era of music took place from 1600 to 1750, as the , artistic style flourished across Europe; and during this time, music expanded in its range and complexity. Baroque music began when the first operas (dramatic solo vocal music accompanied by orchestra) were written. During the Baroque era, , , music, in which multiple, simultaneous independent melody lines were used, remained important (counterpoint was important in the vocal music of the Medieval era). German Baroque composers wrote for small , including ,, ,, and ,, as well as for , and keyboard instruments such as ,, ,, and ,. During this period several major music forms were defined that lasted into later periods when they were expanded and evolved further, including the ,, the ,, the ,, and the concerto., The late Baroque style was polyphonically complex and richly ornamented. Important composers from the Baroque era include , (,), , (,), , and , (,).
,The music of the Classical period (1730 to 1820) aimed to imitate what were seen as the key elements of the art and philosophy of Ancient Greece and Rome: the ideals of balance, proportion and disciplined expression. (Note: the music from the , should not be confused with Classical music in general, a term which refers to Western , from the 5th century to the 2000s, which includes the Classical period as one of a number of periods). Music from the Classical period has a lighter, clearer and considerably simpler texture than the , which preceded it. The main style was ,,, where a prominent , and a subordinate chordal , part are clearly distinct. Classical instrumental melodies tended to be almost voicelike and singable. New genres were developed, and the ,, the forerunner to the modern piano, replaced the Baroque era , and , as the main keyboard instrument (though pipe organ continued to be used in sacred music, such as Masses).
,Importance was given to , music. It was dominated by further development of musical forms initially defined in the Baroque period: the ,, the concerto, and the ,. Other main kinds were the ,, ,, , and ,. The sonata was the most important and developed form. Although Baroque composers also wrote sonatas, the Classical style of sonata is completely distinct. All of the main instrumental forms of the Classical era, from string quartets to symphonies and concertos, were based on the structure of the sonata. The instruments used , and orchestra became more standardized. In place of the , group of the Baroque era, which consisted of harpsichord, organ or lute along with a number of bass instruments selected at the discretion of the group leader (e.g., viol, cello, theorbo, serpent), Classical chamber groups used specified, standardized instruments (e.g., a , would be performed by two violins, a viola and a cello). The practice of improvised chord-playing by the continuo keyboardist or lute player, a hallmark of Baroque music, underwent a gradual decline between 1750-1800.,
,One of the most important changes made in the Classical period was the development of public concerts. The aristocracy still played a significant role in the sponsorship of concerts and compositions, but it was now possible for composers to survive without being permanent employees of queens or princes. The increasing popularity of classical music led to a growth in the number and types of orchestras. The expansion of orchestral concerts necessitated the building of large public performance spaces. Symphonic music including symphonies, musical accompaniment to ballet and mixed vocal/instrumental genres, such as opera and ,, became more popular.,
,The best known composers of Classicism are ,, ,, ,, ,, ,, , and ,. Beethoven and Schubert are also considered to be composers in the later part of the Classical era, as it began to move towards Romanticism.
,Romantic music (, to 1900) from the 19th century had many elements in common with the , styles in literature and painting of the era. Romanticism was an artistic, literary, and intellectual movement was characterized by its emphasis on emotion and individualism as well as glorification of all the past and nature. Romantic music expanded beyond the rigid styles and forms of the Classical era into more passionate, dramatic expressive pieces and songs. Romantic composers such as , and , attempted to increase emotional expression and power in their music to describe deeper truths or human feelings. With symphonic ,, composers tried to tell stories and evoke images or landscapes using instrumental music. Some composers promoted , pride with patriotic orchestral music inspired by ,. The emotional and expressive qualities of music came to take precedence over tradition.,
,Romantic composers grew in idiosyncrasy, and went further in the , of exploring different art-forms in a musical context, (such as literature), history (historical figures and legends), or nature itself. , or longing was a prevalent theme in many works composed during this period. In some cases, the formal structures from the classical period continued to be used (e.g., the , used in , and ,), but these forms were expanded and altered. In many cases, new approaches were explored for existing genres, forms, and functions. Also, new forms were created that were deemed better suited to the new subject matter. Composers continued to develop opera and ballet music, exploring new styles and themes.,
,In the years after 1800, the music developed by , and , introduced a more dramatic, expressive style. In Beethoven's case, short ,, developed organically, came to replace , as the most significant compositional unit (an example is the distinctive four note figure used in his ,). Later Romantic composers such as ,, ,, and , used more unusual , and more , to create dramatic tension. They generated complex and often much longer musical works. During the late Romantic period, composers explored dramatic , alterations of ,, such as , and ,, which created new sound ""colors."" The late 19th century saw a dramatic expansion in the size of the orchestra, and the , helped to create better instruments, creating a more powerful sound. Public concerts became an important part of well-to-do , society. It also saw a new diversity in ,, including ,, and , and other forms of musical theatre.,
,In the 19th century, a key way new compositions became known to the public, was by the sales of ,, which middle class amateur music lovers would perform at home, on their piano or other common instruments, such as the violin. With ,, the invention of new , such as , and , availability of , meant , heard by listeners (on the radio or record player), became the main way to learn about new songs and pieces., There was a vast increase in music listening as the radio gained popularity and , were used to replay and distribute music, anyone with a radio or record player could hear operas, , and , in their own living room. During the 19th century, the focus on sheet music had restricted access to new music to middle and upper-class people who could read music and who owned pianos and other instruments. Radios and record players allowed lower-income people, who could not afford an opera or symphony concert ticket to hear this music. It meant people could hear music from different parts of the country, or even different parts of the world, even if they could not afford to travel to these locations. This helped to spread musical styles.,
,The focus of , in the 20th century was characterized by exploration of new rhythms, styles, and sounds. The horrors of World War I influenced many of the arts, including music, and composers began exploring darker, harsher sounds. , styles such as , and , were used by composers as a source of ideas for classical music. ,, ,, and , were influential composers in 20th-century art music. The invention of sound recording and the ability to edit music gave rise to new subgenres of classical music, including the , and , schools of electronic composition. Sound recording was a major influence on the development of popular music genres, because it enabled recordings of songs and bands to be widely distributed. The introduction of the , system had a major influence on ,, because it could do more than record a band's performance. Using a multitrack system, a band and their music producer could overdub many layers of instrument tracks and vocals, creating new sounds that would not be possible in a live performance.,
,Jazz evolved and became an important genre of music over the course of the 20th century, and during the second half, rock music did the same. Jazz is an American musical artform that originated in the beginning of the 20th century, in African American communities in the Southern United States from a confluence of , and European music traditions. The style's West African pedigree is evident in its use of ,, ,, ,, ,, and the ,.,
,Rock music is a genre of , that developed in the 1950s from ,, ,, ,, and ,., The sound of rock often revolves around the electric or acoustic guitar, and it uses a strong , laid down by a ,. Along with the guitar or keyboards, saxophone and blues-style harmonica are used as soloing instruments. In its ""purest form"", it ""has three chords, a strong, insistent back beat, and a catchy melody."", The traditional rhythm section for popular music is rhythm guitar, electric bass guitar, drums. Some bands have keyboard instruments such as organ, piano, or, since the 1970s, ,. In the 1980s, pop musicians began using digital synthesizers, such as the , synthesizer, electronic , such as the , and synth bass devices (such as the ,) or , keyboards. In the 1990s, an increasingly large range of computerized hardware musical devices and instruments and software (e.g. ,) were used. In the 2020s, , and computer music apps make it possible for , to create and record types of music, such as ,, in their home, adding sampled and digital instruments and editing the recording digitally. In the 1990s, bands in genres such as , began including , in their bands. DJs create music by manipulating recorded music, using a ,.,
,Innovation in music technology continued into the 21st century, including the development of , and ,.
,""Composition"" is the act or practice of creating a song, an , music piece, a work with both singing and instruments, or another type of music. In many cultures, including Western classical music, the act of composing also includes the creation of ,, such as a , ""score"", which is then performed by the composer or by other singers or musicians. In popular music and traditional music, the act of composing, which is typically called songwriting, may involve the creation of a basic outline of the song, called the ,, which sets out the ,, , and ,. In classical music, the composer typically , his or her own compositions, but in musical theatre and in pop music, songwriters may hire an arranger to do the orchestration. In some cases, a songwriter may not use notation at all, and instead, compose the song in her mind and then play or record it from memory. In jazz and popular music, notable recordings by influential performers are given the weight that written scores play in classical music.,
,Even when music is notated relatively precisely, as in classical music, there are many decisions that a performer has to make, because notation does not specify all of the elements of music precisely. The process of deciding how to perform music that has been previously composed and notated is termed ""interpretation"". Different performers' interpretations of the same work of music can vary widely, in terms of the tempos that are chosen and the playing or singing style or , of the melodies. Composers and songwriters who present their own music are interpreting their songs, just as much as those who perform the music of others. The standard body of choices and techniques present at a given time and a given place is referred to as ,, whereas interpretation is generally used to mean the individual choices of a performer.,
,Although a musical composition often uses , and has a single author, this is not always the case. A work of music can have multiple composers, which often occurs in , when a band collaborates to write a song, or in musical theatre, when one person writes the melodies, a second person writes the lyrics, and a third person orchestrates the songs. In some styles of music, such as the ,, a composer/songwriter may create, perform and record new songs or pieces without ever writing them down in music notation. A piece of music can also be composed with words, images, or computer programs that explain or notate how the singer or musician should create musical sounds. Examples range from avant-garde music that uses ,, to text compositions such as ,, to computer programs that select sounds for musical pieces. Music that makes heavy use of randomness and chance is called ,,, and is associated with contemporary composers active in the 20th century, such as ,, ,, and ,. A commonly known example of chance-based music is the sound of , jingling in a breeze.
,The study of composition has traditionally been dominated by examination of methods and practice of Western classical music, but the definition of composition is broad enough to include the creation of , and , songs and instrumental pieces as well as spontaneously , works like those of , performers and African percussionists such as ,.
,Performance is the physical expression of music, which occurs when a song is sung or piano piece, guitar melody, symphony, drum beat or other , is played. In classical music, a work is written in , by a composer and then performed once the composer is satisfied with its structure and instrumentation. However, as it gets performed, the interpretation of a song or piece can evolve and change. In classical music, instrumental performers, singers or conductors may gradually make changes to the phrasing or tempo of a piece. In popular and traditional music, the performers have more freedom to make changes to the form of a song or piece. As such, in popular and traditional music styles, even when a band plays a ,, they can make changes such as adding a , or inserting an introduction.,
,A performance can either be planned out and rehearsed (practiced)—which is the norm in classical music, jazz ,, and many popular music styles–or , over a , (a sequence of chords), which is the norm in small , and , groups. Rehearsals of orchestras, , and , are led by a conductor. Rock, blues and jazz bands are usually led by the bandleader. A rehearsal is a structured repetition of a song or piece by the performers until it can be sung or played correctly and, if it is a song or piece for more than one musician, until the parts are together from a rhythmic and tuning perspective.
,Many cultures have strong traditions of solo performance (in which one singer or instrumentalist performs), such as in Indian classical music, and in the Western art-music tradition. Other cultures, such as in ,, include strong traditions of group performance. All cultures include a mixture of both, and performance may range from improvised solo playing to highly planned and organized performances such as the modern classical concert, religious processions, classical music festivals or ,. ,, which is music for a small ensemble with only one or a few of each type of instrument, is often seen as more intimate than large symphonic works.,
,Musical improvisation is the creation of spontaneous music, often within (or based on) a pre-existing harmonic framework, ,, or ,. Improvisers use the notes of the chord, various scales that are associated with each chord, and chromatic ornaments and passing tones which may be neither chord tones nor from the typical scales associated with a chord. Musical improvisation can be done with or without preparation. Improvisation is a major part of some types of music, such as ,, ,, and ,, in which instrumental performers improvise solos, melody lines, and accompaniment parts..,
,In the Western art music tradition, improvisation was an important skill during the Baroque era and during the Classical era. In the Baroque era, performers improvised ornaments, and , keyboard players improvised , based on , notation. As well, the top soloists were expected to be able to improvise pieces such as ,. In the Classical era, solo performers and singers improvised virtuoso , during concerts.
,However, in the 20th and early 21st century, as ""common practice"" Western , performance became institutionalized in symphony orchestras, opera houses, and ballets, improvisation has played a smaller role, as more and more music was notated in scores and parts for musicians to play. At the same time, some 20th and 21st century , composers have increasingly included improvisation in their creative work. In ,, improvisation is a core component and an essential criterion of performances.
,Music is composed and performed for many purposes, ranging from aesthetic pleasure, religious or ceremonial purposes, or as an entertainment product for the marketplace. When music was only available through , scores, such as during the Classical and Romantic eras, music lovers would buy the sheet music of their favourite pieces and songs so that they could perform them at home on the piano. With the advent of the ,, records of popular songs, rather than sheet music became the dominant way that music lovers would enjoy their favourite songs. With the advent of home , in the 1980s and , in the 1990s, music lovers could make tapes or , of favourite songs and take them with them on a portable , or MP3 player. Some music lovers create , of favourite songs, which serve as a ""self-portrait, a gesture of friendship, prescription for an ideal party... [and] an environment consisting solely of what is most ardently loved"".,
,Amateur musicians can compose or perform music for their own pleasure and derive income elsewhere. , are employed by institutions and organisations, including armed forces (in ,, , and popular music groups), religious institutions, symphony orchestras, broadcasting or , companies, and ,. Professional musicians sometimes work as freelancers or ,, seeking contracts and engagements in a variety of settings. There are often many links between amateur and professional musicians. Beginning amateur musicians take , with professional musicians. In community settings, advanced amateur musicians perform with professional musicians in a variety of ensembles such as community , and community orchestras.
,A distinction is often made between music performed for a live audience and music that is performed in a studio so that it can be recorded and distributed through the music retail system or the broadcasting system. However, there are also many cases where a live performance in front of an audience is also recorded and distributed. Live concert recordings are popular in both classical music and in , forms such as rock, where , are prized by music lovers. In the , scene, live, improvised , are preferred to studio recordings.,
,Music notation typically means the written expression of music notes and rhythms on paper using symbols. When music is written down, the pitches and rhythm of the music, such as the notes of a ,, are notated. Music notation often provides instructions on how to perform the music. For example, the sheet music for a song may state the song is a ""slow blues"" or a ""fast swing"", which indicates the tempo and the genre. To read notation, a person must have an understanding of ,, , and the , associated with a particular song or piece's genre.
,Written notation varies with the style and period of music. Nowadays, notated music is produced as , or, for individuals with computer , programs, as an image on a ,. In ancient times, music notation was put onto stone or clay tablets., To perform music from notation, a singer or instrumentalist requires an understanding of the rhythmic and pitch elements embodied in the symbols and the performance practice that is associated with a piece of music or genre. In genres requiring ,, the performer often plays from music where only the , and form of the song are written, requiring the performer to have a great understanding of the music's structure, harmony and the styles of a particular genre e.g., jazz or ,.
,In Western art music, the most common types of written notation are scores, which include all the music parts of an ensemble piece, and parts, which are the music notation for the individual performers or singers. In popular music, jazz, and blues, the standard musical notation is the ,, which notates the melody, chords, , (if it is a vocal piece), and structure of the music. Fake books are also used in jazz; they may consist of lead sheets or simply chord charts, which permit , members to improvise an , part to jazz songs. Scores and parts are also used in popular music and jazz, particularly in large ensembles such as jazz "",."" In popular music, guitarists and electric bass players often read music notated in , (often abbreviated as ""tab""), which indicates the location of the notes to be played on the instrument using a diagram of the guitar or bass fingerboard. Tablature was used in the Baroque era to notate music for the ,, a stringed, fretted instrument.,
,Many types of music, such as traditional , and , were not written down in ,; instead, they were originally preserved in the memory of performers, and the songs were handed down ,, from one musician or singer to another, or aurally, in which a performer learns a song "","". When the composer of a song or piece is no longer known, this music is o",,,,,,,,,,,,,,,,,,,,,,,,,,,,,,,,,,,,,,,,,,,,,,,,,,,,,,,,,,,,,,,,,,,,,,,,,,,,,,,,,,,,,,,,,,,,,,,,,,,,,,,,,,,,,,,,,,,,,,,,,,,,,,,,,,,,,,,,,,,,,,,,,,,,,,,,,,,,,,,,,,,,,,,,,,,,,,,,,,,,,,,,,,,,,,,,,,,,,,,,,,,,,,,,,,,,,,,,,,,,,,,,,,,,,,,,,,,,,,,,,,,,,,,,,,,,,,,,,,,,,,,,,,,,,,,,,,,,,,,,,,,,,,,,,,,,,,,,,,,,,,,,,,,,,,,,,,,,,,,,,,,,,,,,,,,,,,,,,,,,,,,,,,,,,,,,,,,,,,,,,,,,,,,,,,,,,,,,,,,,,,,,,,,,,,,,,,,,,,,,,,,,,,,,,,,,,,,,,,,,,,,,,,,,,,,,,,,,,,,,,,,,,,,,,,,,,,,,,,,,,,,,,,,,,,,,,,,,,,,,,,,,,,,,,,,,,,,,,,,,,,,,,,,,,,,,,,,,,,,,,,,,,,,,,,,,,,,,,,,,,,,,,,,,,,,,,,,,,,,,,,,,,,,,,,,,,,,,,,,,,,,,,,,,,,,,,,,,,,,,,,,,,,,,,,,,,,,,,,,,,,,,,,,,,,,,,,,,,,,,,,,,,,,,,,,,,,,,,,,,,,,,,,,,,,,,,,,,,,,,,,,,,,,,,,,,,,,,,,,,,,,,,,,,,,,,,,,,,,,,,,,,,,,,,,,,,,,,,,,,,,,,,,,,,,,,,,,,,,,,,,,,,,,,,,,,,,,,,,,,,,,,,,,,,,,,,,,,,,,,,,,,,,,,,,,,,,,,,,,,,,,,,,,,,,,,,,,,,,,,,,,,,,,,,,,,,,,,,,,,,,,,,,,,,,,,,,,,,,,,,,,,,,,,,,,,,,,,,,,,,,,,,,,,,,,,,,,,,,,,,,,,,,,,,,,,,,,,,,,,,,,,,,,,,,,,,,,,,,,,,,,,,,,,,,,,,,,,,,,,,,,,,,,,,,,,,,,,,,,,,,,,,,,,,,,,,,,,,,,,,,,,,,,,,,,,,,,,,,,,,,,,,,,,,,,,,,,,,,,,,,,,,,,,,,,,,,,,,,,,,,,,,,,,,,,,,,,,,,,,,,,,,,,,,,,,,,,,,,,,,,,,,,,,,,,,,,,,,,,,,,,,,,,,,,,,,,,,,,,,,,,,,,,,,,,,,,,,,,,,,,,,,,,,,,,,,,,,,,,,,,,,,,,,,,,,,,,,,,,,,,,,,,,,,,,,,,,,,,,,,,,,,,,,,,,,,,,,,,,,,,,,,,,,,,,,,,,,,,,,,,,,,,,,,,,,,,,,,,,,,,,,,,,,,,,,,,,,,,,,,,,,,,,,,,,,,,,,,,,,,,,,,,,,,,,,,,,,,,,,,,,,,,,,,,,,,,,,,,,,,,,,,,,,,,,,,,,,,,,,,,,,,,,,,,,,,,,,,,,,,,,,,,,,,,,,,,,,,,,,,,,,,,,,,,,,,,,,,,,,,,,,,,,,,,,,,,,,,,,,,,,,,,,,,,,,,,,,,,,,,,,,,,,,,,,,,,,,,,,,,,,,,,,,,,,,,,,,,,,,,,,,,,,,,,,,,,,,,,,,,,,,,,,,,,,,,,,,,,,,,,,,,,,,,,,,,,,,,,,,,,,,,,,,,,,,,,,,,,,,,,,,,,,,,,,,,,,,,,,,,,,,,,,,,,,,,,,,,,,,,,,,,,,,,,,,,,,,,,,,,,,,,,,,,,,,,,,,,,,,,,,,,,,,,,,,,,,,,,,,,,,,,,,,,,,,,,,,,,,,,,,,,,,,,,,,,,,,,,,,,,,,,,,,,,,,,,,,,,,,,,,,,,,,,,,,,,,,,,,,,,,,,,,,,,,,,,,,,,,,,,,,,,,,,,,,,,,,,,,,,,,,,,,,,,,,,,,,,,,,,,,,,,,,,,,,,,,,,,,,,,,,,,,,,,,,,,,,,,,,,,,,,,,,,,,,,,,,,,,,,,,,,,,,,,,,,,,,,,,,,,,,,,,,,,,,,,,,,,,,,,,,,,,,,,,,,,,,,,,,,,,,,,,,,,,,,,,,,,,,,,,,,,,,,,,,,,,,,,,,,,,,,,,,,,,,,,,,,,,,,,,,,,,,,,,,,,,,,,,,,,,,,,,,,,,,,,,,,,,,,,,,,,,,,,,,,,,,,,
